,id,created_at,text,topic,sentiment
711,1.46762E+18,2021-12-05T22:40:28.000Z,I be feeling bad cause I haven’t lived my life like I wanted to but I’m also actually raising my kids but I vowed to do more next year but that’s up to Covid 🥴,Vaccine,Negative
712,1.46762E+18,2021-12-05T22:40:19.000Z,currently having an asthmatic attack... hope it's not covid..,Impact,Negative
713,1.46762E+18,2021-12-05T22:40:18.000Z,no one… and i mean NO ONE EVER SAID YOU CANT GET OR CARRY COVID WHILE VACCINATED…. HXJAHSJS SHUT UPPP,Testing,Positive
714,1.46762E+18,2021-12-05T22:40:17.000Z,Prevention is better than cure!   In India #Omicron tally pushed to 21. #COVID19,Restrictions,Positive
715,1.46762E+18,2021-12-05T22:40:12.000Z,If You died in a Car accident - Covid killed You  Die from a gunshot wound ? - Covid killed You Die from being stabbed to death ? - Yeah Covid killed You.  Evil is on the Rise all over the World.. fight back.,Symptoms,Positive
716,1.46762E+18,2021-12-05T22:40:10.000Z,"What a way to end the weekend - watching the lot who thought Andrew Neil was One of Them because he created GB News, only to find out he has had all three vaccinations and is pro COVID passports 😂",Vaccine,Negative
717,1.46762E+18,2021-12-05T22:40:08.000Z,my brother was FaceTiming me while he was in Target and I said I don’t feel good and he hung up on me and texted me saying people were gunna think I was talking to someone who had COVID so I had to hang up 😂 wut?,Vaccine,Negative
718,1.46762E+18,2021-12-05T22:40:02.000Z,Covid hasn't changed anything which was not happening before...it's the people running the show who have caused an upheavel world over.,Demography,Neutral
719,1.46762E+18,2021-12-05T22:39:58.000Z,Corporate owned msm lies I have had to navigate:  Santa easter bunny  the sun is bad  meat is bad  canola oil is good governments serve you  Bill Gates is a philanthropist  Bill Gates is an infectious disease expert COVID vaccine effectiveness Vax adverse reactions Got any more?,Variant,Positive
720,1.46762E+18,2021-12-05T22:39:56.000Z,I’ve literally never had a busier week than I do this week and of course it coincides with 1 manager being off and the other having COVID. Wonder Woman it is 😳,Demography,Neutral
721,1.46762E+18,2021-12-05T22:39:48.000Z,Diontae aint never gon catch Covid. @Juiceup__3,Demography,Negative
722,1.46762E+18,2021-12-05T22:39:42.000Z,The people that are bitching about COVID restrictions are the people that are keeping this pandemic going,Symptoms,Negative
723,1.46762E+18,2021-12-05T22:39:41.000Z,More than likely probably have Covid :-),Symptoms,Neutral
724,1.46762E+18,2021-12-05T22:39:38.000Z,"GDI. Got notification that I could schedule a covid shot, but because the link was a giant complicated thong that came via SMS and UW's scheduling site is buggy on mobile, lost my original slot for this week and had to reschedule a week later. 😠",Vaccine,Negative
725,1.46762E+18,2021-12-05T22:39:32.000Z,I wish y’all would stop hopping in health care workers’ mentions and suggesting that they “just” turn unvaccinated Covid patients away to die.   That is a very fucked up thing to causally suggest to someone.,Impact,Negative
726,1.46762E+18,2021-12-05T22:39:28.000Z,165 new cases and 3 new deaths in Tunisia   [23:39 GMT] #coronavirus #CoronaVirusUpdate #COVID19 #CoronavirusPandemic,Symptoms,Positive
727,1.46762E+18,2021-12-05T22:39:27.000Z,"Omicron might be set to be the good Covid (if there is such a thing). Zero deaths so far from it by all accounts that I have seen. If contracting it gives greater resistance to Delta, I say ""let it loose!"". Omicron could well be the Covid that ends Covid, as we know it.",Impact,Positive
728,1.46762E+18,2021-12-05T22:39:21.000Z,"People still dying from COVID-19, be careful.",Impact,Negative
729,1.46762E+18,2021-12-05T22:39:11.000Z,"im so sorry to all the people in mcyttwt who were never here to experience the things like masktwtselfieday, the covid party, the burner44z account, mangoball's cheater AU, etc etc. taking place",Testing,Neutral
730,1.46762E+18,2021-12-05T22:39:10.000Z,jUST HAD TO SEND MY COWORKER TO MY CAR TO GET MY COVID INHALER BC I JUST HAD TO SPEED RESET THREE ROOMS BY MYSELF AND I AM WHEEZING,Testing,Negative
731,1.46762E+18,2021-12-05T22:39:04.000Z,"think i have covid kr just a bad cold, took a test though",Demography,Negative
732,1.46762E+18,2021-12-05T22:39:03.000Z,"I found out about an hr ago, a friend, who was vaccinated is dead of Covid. Fuck off with your vaccine.",Demography,Neutral
733,1.46762E+18,2021-12-05T22:39:02.000Z,If i see one more union fan post saying let’s blame the players who had covid for this results. I’ll lose it,Vaccine,Negative
734,1.46762E+18,2021-12-05T22:39:02.000Z,Well guys and gals I don't have a cold I have covid so I will try to get on but no promises. Hope everyone has a good day  and for all the streamers have a great stream today!!!!!,Impact,Negative
735,1.46762E+18,2021-12-05T22:38:59.000Z,Thank God I have lost anyone import to me to Covid.,Demography,Negative
736,1.46762E+18,2021-12-05T22:38:58.000Z,covid boy is a fraud,Impact,Neutral
737,1.46762E+18,2021-12-05T22:38:58.000Z,Does anybody know if I can say I have covid so I can extend my vacation without the airline charging me?,Impact,Negative
738,1.46762E+18,2021-12-05T22:38:44.000Z,"I got covid in March, and I was in the ER for all of 4 hours and I got a bill for 800$ for basically taking up a bed while I waited for the test results and the nurse to keep checking my 02 every 30 minutes 🙃",Impact,Neutral
739,1.46762E+18,2021-12-05T22:38:38.000Z,"You know what the #dems ace put their sleeve is for 2022?  They will declare victory over #covid, and the morons will rejoice #Democrats",Testing,Negative
740,1.46762E+18,2021-12-05T22:38:37.000Z,Just thinking what a George Carlin show would be like in the age of Covid.,Vaccine,Negative
741,1.46762E+18,2021-12-05T22:38:34.000Z,BBC Westminster Hour guests going on about dangerous info on SM. What would that be? Young people suffering serious side effects from vax? Majority of covid patients in hospital are vaxxed? The unexplained surge in stillbirths? All claims are supported by government or BMA data.,Other,Negative
742,1.46762E+18,2021-12-05T22:38:31.000Z,"If you’ve not been through the entire fit-test procedure for an N95 or KN95 mask, then it’s probably pointless, and just for COVID theater. Stop wasting money.",Symptoms,Positive
743,1.46762E+18,2021-12-05T22:38:31.000Z,"GOP-Republicans:HYPOCRITES-liars;GOP says GOVT shouldnt tell people what to do,shouldnt infringe on peoples’ rights,BUT,with issues:covid,abortion:GOP TELLING PEOPLE WHAT TO DO;VOTE DEMOCRAT.White male republicans only care for rich White males,do not care about women,minorities!",Impact,Negative
744,1.46762E+18,2021-12-05T22:38:29.000Z,Now I know why Big Ben wants to retire! His receivers can’t catch Covid!!!,Impact,Negative
745,1.46762E+18,2021-12-05T22:38:23.000Z,"Since COVID hit, I have been in constant survival mode.  Finally getting around to confronting the emotional effects of 2020 and working hard to take back control of my life and not constantly be living in reaction to this insane time we’re living through.",Vaccine,Neutral
746,1.46762E+18,2021-12-05T22:38:20.000Z,A friend of the family just died from Covid. His mother was fully vaccinated &amp; boosted but died from Covid about 3 weeks ago. Her son &amp; his wife took care of her at her home before she became too ill &amp; had to be taken to the hospital. His wife is still in ICU &amp; is also very ill.,Impact,Negative
747,1.46762E+18,2021-12-05T22:38:18.000Z,"the plan to force reimbursement for covid tests, as opposed to heavily subsidizing them so they are cheap at the point of purchase as europe has, seems silly. the latter option is easier on consumers, maintains competition and incentivizes companies on the front end.",Vaccine,Negative
748,1.46762E+18,2021-12-05T22:38:15.000Z,This is the third person that I know that’s caught covid in a week and is double jabbed 🤔,Demography,Neutral
749,1.46762E+18,2021-12-05T22:38:15.000Z,Been staying away from niggas before that COVID hit.,Other,Negative
750,1.46762E+18,2021-12-05T22:38:14.000Z,Ever since I had covid I constantly taste merlot in my mouth,Impact,Negative
751,1.46762E+18,2021-12-05T22:38:12.000Z,Tasmanian healthcare workers concerned system is underprepared to manage COVID cases ahead of border reopening,Demography,Negative
752,1.46762E+18,2021-12-05T22:38:06.000Z,"this has been said over and over again but I fucking despise when people are talking about covid (or anything like it) and they're like ""it only targets old people and sick people so we dont have to worry"" which to me translates to ""this disease targets people we can't commodify",Vaccine,Negative
753,1.46762E+18,2021-12-05T22:38:05.000Z,"just got my covid booster vaccine, will update w/any side effects",Demography,Negative
754,1.46762E+18,2021-12-05T22:38:00.000Z,"bruh fuck covid, this shit is miserable",Vaccine,Negative
755,1.46762E+18,2021-12-05T22:37:50.000Z,UK will have its home treatment for Covid/Omicron available by Christmas. Lageviro (Mulnupiravir) anti viral drug. When will it be available in NZ @AndrewLittleMP @chrishipkins @DrShaneRetiMP,Impact,Neutral
756,1.46762E+18,2021-12-05T22:37:49.000Z,"Oldest’s private music teacher, who he hasn’t seen since COVID started, passed away about a week ago. Such a sweet soul. Talented sax player. Our region lost a good one with the passing of Tom Delaney.",Demography,Negative
757,1.46762E+18,2021-12-05T22:37:49.000Z,"#COVID19 @RandPaul #FJB #Congress Eric Clapton @GOP So, who is getting compensated for women's umbilical cords, rich with stem cells that can turn into any part of the body? And why are they stolen from women after they give birth, by the hospital?",Vaccine,Negative
758,1.46762E+18,2021-12-05T22:37:42.000Z,Somebody at Day 2 of Wizkid’s concert had COVID and spread it everywhere,Vaccine,Neutral
759,1.46762E+18,2021-12-05T22:37:40.000Z,$BTC I hate this more than I hate Covid 🪄  #RecvProfit,Restrictions,Positive
760,1.46762E+18,2021-12-05T22:37:20.000Z,"It’s hugely disappointing is that @MacaesBruno is accusing the Brits for spreading misinformation about COVID all over Europe.  After a rocky start, the UK is leading the fight against COVID by (AZ vaccine, 12 week period, boosters, “steering” the 4th wave in summer).  1/3",Impact,Neutral
761,1.46762E+18,2021-12-05T22:37:20.000Z,#COVID19 hitting my family today. One member sick and another branch of family has a member expected to not survive the evening. All vaccinated. #GetBoosted I hate 🦠 This is why husband and I spent Thanksgiving alone. Again.,Impact,Negative
762,1.46762E+18,2021-12-05T22:37:19.000Z,"Geez, @cvspharmacy, I would say it's pretty bad form to schedule COVID boosters and then not have the staff to administer. Got to my appointment at 5 today, only to be told that the pharmacy had closed at 2.",Vaccine,Neutral
763,1.46762E+18,2021-12-05T22:37:16.000Z,just got word a high school friends father died of covid. Unvaccinated.,Vaccine,Negative
764,1.46762E+18,2021-12-05T22:37:14.000Z,i would love to win the dream box 🥺 i had tickets last march but covid obviously messed it up and i’m close to spokane! i shared the stream and am trying to donate @ColleenB123 @Korsoto,Vaccine,Positive
765,1.46762E+18,2021-12-05T22:37:04.000Z,I see basic biology failed a lot of people 😭 they’re really arguing that “mRNA is dangerous” 🥴 Sir your own body creates mRNA it’s just a messenger single strand DNA that can leave the nucleus of your cell and carry the genetic code for proteins. Why is covid political uhh,Impact,Negative
766,1.46762E+18,2021-12-05T22:37:02.000Z,"I've had more vaccinations than most people for a variety of reasons, so why am I anti vax because I haven't had the covid vaccine?????  I don't believe in vaccine passports but why does that make me anti vax????",Impact,Negative
767,1.46762E+18,2021-12-05T22:36:41.000Z,“They don’t know anything about Covid. Is it good? Is it bad?”  Me: *eternally grateful my employers still require me to wear a mask*,Other,Neutral
768,1.46762E+18,2021-12-05T22:36:32.000Z,Y’all pray for my mom she has covid and is in the hospital 😔,Symptoms,Negative
769,1.46762E+18,2021-12-05T22:36:30.000Z,"Dr. Scott Atlas on the Covid Task Force: ""The acceptance of such blatantly flawed conclusions by the people formulating policy at the highest levels was deeply disheartening.""",Demography,Negative
770,1.46762E+18,2021-12-05T22:36:30.000Z,Got the covid booster and flu shot at the same time. I may come to regret this very VERY soon.,Impact,Neutral
771,1.46762E+18,2021-12-05T22:36:30.000Z,"How do you know it’s all bs?  When they don’t have separate tests for regular covid, Delta variant, and Omicron variant.  I rest my case.  P.S. It’s also flu season.",Demography,Negative
772,1.46762E+18,2021-12-05T22:36:25.000Z,"It appears all #Democrats are getting low approval rating which is sabotaging the #Biden administration. From the first day, Biden and Harris have been working hard to pass legislation supporting all Americans.  Big Battle is #COVID19 getting Vaccinated is a must.",Other,Positive
773,1.46762E+18,2021-12-05T22:36:23.000Z,the way the us has been handling covid is terrible,Vaccine,Neutral
774,1.46762E+18,2021-12-05T22:36:22.000Z,"The speed at which this Government has arranged an inquiry into the murder of baby Arthur is to be applauded.  Why, then, will the Covid inquiry be delayed from May 2021 to beyond Spring 2022?  Are they quick to point the finger but reluctant to accept any responsibility?",Vaccine,Positive
775,1.46762E+18,2021-12-05T22:36:21.000Z,The word of 2021 FEARPORN #Fearporn #angstporno #Covid19 #psychowar #Agenda2030  #TheGreatReset  #BuildBackBetter  #youownnothingandwillbehappy #klausschwab  #,Impact,Neutral
776,1.46762E+18,2021-12-05T22:36:15.000Z,Honestly very confused how a doctor can say you have a respiratory infection without even listening to the patients lungs because you’re still obsessed with the fact that I don’t have covid?! You don’t want to touch me even though I’m neg on all your tests? Isn’t that negligence?,Other,Neutral
777,1.46762E+18,2021-12-05T22:36:14.000Z,guys my mum and dad are now both positive for covid… actually dk what I’m gonna do this is so shit,Symptoms,Positive
778,1.46762E+18,2021-12-05T22:36:10.000Z,"The media scares the living crap out or people with #covid and #OmicronVariant for clicks and views, then runs stories about how anxiety is higher than ever.   Great business model if you can get away with it.",Symptoms,Positive
779,1.46762E+18,2021-12-05T22:36:04.000Z,"Peta Credlin. Forced to apologise to Sudanese Community! What a nasty piece of work she is. Peta Credlin, dont forget to call out the very few white community who can pass the Covid Virus on to us. You are racist, unintelligent &amp; full of hate for all that is good &amp; not Liberal.",Vaccine,Positive
780,1.46762E+18,2021-12-05T22:36:03.000Z,"Watching the Ravens, creates Paramount account just to watch Post Covid Southpark. 😂",Vaccine,Neutral
781,1.46762E+18,2021-12-05T22:35:58.000Z,"I am 1000% pro covid vax, but after my first ever flu shot friday puttin me down for count 48hrs just gonna take my chances….i live in cali , life isn’t real here anyways the flu is a myth",Restrictions,Positive
782,1.46762E+18,2021-12-05T22:35:48.000Z,"⚠️Another “Christian” Televangelist (Marcus Lamb) choked on His Anti-Vaxxer Rhetoric and died from Covid. Good riddance to Covidiots like him and the Ones who believe the 🐃💩these Quacks are preaching, in the name of a fictional Entity. #GetVaccinatedNow",Other,Neutral
783,1.46762E+18,2021-12-05T22:35:45.000Z,Canada: Barbaric Cultural Practices in 5 tweets.  Covid Pandemic Edition  #OmicronVirus  #MedicalApartheid  #MedicalRacism #PoliticalGaslighting,Impact,Neutral
784,1.46762E+18,2021-12-05T22:35:43.000Z,"Asking for a friend, is there anywhere else you can go if you have to self-isolate due to Covid, but you're not safe at home?",Variant,Neutral
785,1.46762E+18,2021-12-05T22:35:41.000Z,Account of recent Covid positive experience in Melbourne from morning dog park regular: - 2nd dose in July - started feeling unwell around 22/11 - likely exposure at hospo venue on 20/11 - RAT positive - did PCR on 24/11 and isolated - never got text or call about PCR result  1/5,Other,Neutral
786,1.46762E+18,2021-12-05T22:35:38.000Z,"Every time I get a sore throat I panic about COVID. Thankfully the King is tolerant and provides me with testing kits. Should have bought stock in Quidel, I comment. #FullyVaxxedFullyParanoid",Vaccine,Positive
787,1.46762E+18,2021-12-05T22:35:35.000Z,"It's day 3 after the COVID booster jab and I still feel like garbage. Worth it, cuz it's going to save my life and help others, but lawdy. This is ROUGH. #thoughtsandprayers",Vaccine,Negative
788,1.46762E+18,2021-12-05T22:35:11.000Z,Today .... 2 people I know ...vaxed in the hospital... one with stroke after Covid dx the other Covid with ???? After dx .... still no of no one who has died of Covid.,Impact,Negative
789,1.46762E+18,2021-12-05T22:35:06.000Z,"Right some cultural recommendations from Covid isolation: - Ridley Road (series, iPlayer) - implausible in parts but interesting about British fascism in the 60s, esp in light of today’s climate - Falling for Figaro (film, Netflix)- silly romcom about aspiring opera singers. V me",Vaccine,Positive
790,1.46762E+18,2021-12-05T22:35:05.000Z,So... when does climate change infect murder hornets with covid angering qanon and causing them to bomb dallas... happen? After the last 2 years that scenario is not entirely out of the question.,Variant,Neutral
791,1.46762E+18,2021-12-05T22:35:04.000Z,"Just fed up now 😢 Eating dinner for most is just a normal thing but When i have to worry every time I eat and the pain that comes with it…. It gets to me , 😢 hopefully in January 2022 my operation will make things better, #covid delayed it !  #hiddenillness #hiddendisabilty",Demography,Neutral
792,1.46762E+18,2021-12-05T22:35:00.000Z,Omicron is already in Ontario. Delta is wreaking havoc already. Infections are on the rise unlike any time this year. Precautions are going away faster &amp; pandemic is being downplayed. Oh &amp; Original Covid is showing no sign of going away.  The Mother Of All Waves will be deadlier.,Demography,Neutral
793,1.46762E+18,2021-12-05T22:34:56.000Z,yea u r going to hell if you ghost someone while theyre in covid isolation after you’ve been talking for two months… you are a really bad person.,Other,Positive
794,1.46762E+18,2021-12-05T22:34:54.000Z,#OmicronVariant  is SO FRUSTRATING!! But the bright side is I got my booster shot today! It gives me hope. :-). PLEASE vaccinate. Get your booster shot. WEAR A MASK!!! #COVID19 #CovidVaccine,Impact,Neutral
795,1.46762E+18,2021-12-05T22:34:46.000Z,"So... They watered down the 💉 &amp; immediately approve it for kids of 5yo! NO stringent testing regime, just a ""she'll be right, safe &amp; effective"" 😳 Just 2 years ago this would have been called CRIMINAL NEGLIGENCE! What parent thinks this is OK?  COVID = BRAIN DISEASE!  🤡🌍",Demography,Positive
796,1.46762E+18,2021-12-05T22:34:46.000Z,"👀 LOOK WHO they put in charge of AUST COVID-19  plandamic National Task Force coordinator JANE HALTON  👉 After attending a pre Plandamic exercise in USA OCTOBER  2019 organised by BILL GATES CIA &amp; BIG PHARMA WEF . The Event 201 pandemic exercise, October 18, 2019. Coincidence ?",Vaccine,Negative
797,1.46762E+18,2021-12-05T22:34:44.000Z,All 3 kids got their 1st covid vaccine this morning. The arms are a lil sore otherwise they feel great . Getting their second shot January 31 and i feel then i am able to feel better about doing ya know something like concerts 👀,Impact,Positive
798,1.46762E+18,2021-12-05T22:34:40.000Z,"Birx Think: Birx emphasized to the Covid Task Force that this infection was extremely dangerous exactly because it was so commonly asymptomatic, or so mild that it went unnoticed",Vaccine,Positive
799,1.46762E+18,2021-12-05T22:34:36.000Z,"Love hearing everyone’s stories during @ColleenB123 ‘s #ChildhoodCancerFundraiser🎗every year! Wish I could donate so much more than I have in years past, but this past yr I was laid off due to my long term Covid side effects. So I’m not making as much as I was before.",Impact,Negative
800,1.46762E+18,2021-12-05T22:34:35.000Z,"15-YEAR-OLD, NO UNDERLYING CONDITIONS, HAS DIED OF COVID19 IN JOBURG, SOUTH AFRICA. Prof Mathivha, ICU Head at hospital in Joburg,South Africa, says more children being admitted with covid. Warns:""We need to put children in a place where they're not exposed to contracting covid.""",Vaccine,Neutral
801,1.46762E+18,2021-12-05T22:34:22.000Z,"Saw an awful movie last night. The Survivalist , about the world after COVID 19- Delta ravaged the world and left it lawless and everyone on their own (kind of a walking dead feel)  Only hope was a woman who had acquired natural immunity and would breed a new world 🤣🤣🤣",Demography,Negative
802,1.46762E+18,2021-12-05T22:34:19.000Z,"The Gateway Pundit also added: ""When all is said and done and the waters settle on the COVID pandemic, Dr. Anthony Fauci may be remembered as one of the greatest mass killers of our time.""",Symptoms,Neutral
803,1.46762E+18,2021-12-05T22:34:19.000Z,"A COVID patient I took care of 6 months ago brought me a special, hand painted, personalized wine glass today as a thank you gift. I was the only nurse whose name she remembered from her month long stay. It brought tears to my eyes",Other,Negative
804,1.46762E+18,2021-12-05T22:34:18.000Z,My mom tested positive for covid but got the shot… I have so many questions 🤧,Impact,Positive
805,1.46762E+18,2021-12-05T22:34:17.000Z,"""according to China, they did the best at handling covid out of all the world's government's, so I am now a cheerleader of China style communism"" -Yarvin in his latest",Symptoms,Neutral
806,1.46762E+18,2021-12-05T22:34:17.000Z,"I got my booster shot today. Even though #OmicronVariant might have developed resistance to the vaccines, we still don't know for sure. Vaccinating, getting the booster shots and social distancing is still the best way to fight covid. #COVID19 #CovidVaccine",Impact,Negative
807,1.46762E+18,2021-12-05T22:34:16.000Z,At a football game. If Americans got as worked up about Covid and Democracy as much as messed up Seahawks plays the pandemic would be over and all 1/6 conspirators would be in prison.,Symptoms,Neutral
808,1.46762E+18,2021-12-05T22:34:15.000Z,"Obviously it is known that L Wright has no possible medical issues that would be compromised by the current three COVID shot offerings, clearly there is no medical advice that was given that has the performer in a niche ""should not take the shots"" case.  /s",Symptoms,Negative
809,1.46762E+18,2021-12-05T22:34:15.000Z,Recently lost a 4th member of my family this year and I’m feeling sad about the reality of getting older. 2/4 deaths have been covid related and we haven’t been able to have a funereal for 3 of them. Really hoping i can get some time off next Monday to attend this service 😞,Impact,Neutral
810,1.46762E+18,2021-12-05T22:34:12.000Z,is a headache and shivering a sign of covid?,Impact,Negative
811,1.46762E+18,2021-12-05T22:34:03.000Z,#bbcnews You're not reporting the #PoliceBill . You're concentrating on #COVID19. Stop pandering to the government.  REPORT on the #PoliceBill that will affect everyone. Sleepwalking into a fascist state.,Restrictions,Positive
812,1.46762E+18,2021-12-05T22:34:03.000Z,I’m currently watching the 2020 one and it was even better than this years and they had no crowd or anything due to COVID. This year was poor 😖😂 #MOBOAwards,Demography,Positive
813,1.46762E+18,2021-12-05T22:33:59.000Z,"Anyone had all the flavours of COVID? Or is it one per customer, once you’ve had one, you can’t have another?",Demography,Neutral
814,1.46762E+18,2021-12-05T22:33:57.000Z,The weather at the start of the first covid lockdown was banging. It’s been SHIT ever since.,Demography,Positive
815,1.46762E+18,2021-12-05T22:33:56.000Z,I’ve been sick for like 3 days straight and my body feels so weak (it’s chorro not Covid btw). But once I recover I’m def gonna start working out and eating better😤,Symptoms,Positive
816,1.46762E+18,2021-12-05T22:33:56.000Z,"I don’t really talk about my health much but getting covid at the start of 2021 caused me to have Chronic Fatigue Syndrome. As someone who loved active jobs, I’m honestly grieving my loss of ability to do them now. Being sick or my period wipes my energy.",Restrictions,Neutral
817,1.46762E+18,2021-12-05T22:33:55.000Z,What post-COVID 19 convenience app do you think we need in the educational/health sector?,Variant,Positive
818,1.46762E+18,2021-12-05T22:33:54.000Z,There’s no crying over @lego but I am.1st to agree to purchase large lot of legos on marketplace. Christmas gifts for grandkids.Covid prevents unnecessary shopping.Sadly not sold to me. So many bigger &amp; more important disappointments &amp; disasters in life I know but I’m still 😭 🤷‍♀️,Restrictions,Neutral
819,1.46762E+18,2021-12-05T22:33:46.000Z,It’s always the people who have had COVID multiple times telling you how to live and what to do with your body... ma’am I work with children who can’t wear the mask and I have yet to contract it....what are you even doing giving advice on the matter.....protect yourself😱,Demography,Neutral
820,1.46762E+18,2021-12-05T22:33:44.000Z,Ok so 10:30 on Sunday night means I’m an hour and a half early. But I had a nice weekend with it being covid twitter free.,Demography,Negative
