,id,created_at,text,topic,sentiment
472,1.46763E+18,2021-12-05T22:52:33.000Z,Temporary electronic sign along I-4 near Kathleen Road exit alerts drivers to free COVID testing at RP Funding Center.,Vaccine,Positive
473,1.46763E+18,2021-12-05T22:52:30.000Z,i am overthinking help me. even though i don’t have to isolate i am right in not going to college while both my parents have covid correct,Impact,Negative
474,1.46763E+18,2021-12-05T22:52:26.000Z,"Jim Curtin: ""COVID sucks. Could the protocols be updated, I don't know, but they are what they are I guess. I just feel bad for the 11 guys who couldn't play, who had amazing seasons."" #DOOP",Symptoms,Negative
475,1.46763E+18,2021-12-05T22:52:23.000Z,"Tbh if COVID started in Africa, the entire world will isolate us and abandon us.",Vaccine,Negative
476,1.46763E+18,2021-12-05T22:52:21.000Z,Eyyyy one of my students tested positive for Covid and now I feel horrible because I saw some of my friends yesterday.,Impact,Negative
477,1.46763E+18,2021-12-05T22:52:20.000Z,"Curtin: ""You’re at a loss for words. I just feel bad for the guys that weren’t here. They had incredible seasons. COVID sucks. I don’t know what else to say. The protocols are the protocols.""",Demography,Neutral
478,1.46763E+18,2021-12-05T22:52:17.000Z,did u lose any friends over covid vaccine BS,Restrictions,Negative
479,1.46763E+18,2021-12-05T22:52:17.000Z,Just took a Covid test &amp; I’m negative 😍😍😍,Symptoms,Negative
480,1.46763E+18,2021-12-05T22:52:17.000Z,Apparently we're loosing a member of Clan Robertson in the next couple of days. Stupid covid.  Don't forget to tell your loved ones you love them - and please get vaccinated / wear masks / stay safe,Vaccine,Negative
481,1.46763E+18,2021-12-05T22:52:13.000Z,"Ugh. @PhilaUnion loss was a heartbreaker.  Kids put on a hell of a show, but what are you supposed to do when your entire defense is out for COVID protocols. Fuck COVID.",Restrictions,Negative
482,1.46763E+18,2021-12-05T22:52:11.000Z,"One year ago, I was in the hospital battling for my life with Covid-19 and pneumonia. But God!",Restrictions,Negative
483,1.46763E+18,2021-12-05T22:52:10.000Z,"How do people deal with siblings who are anti-vax? How do you reconcile the feelings of worry vs the horrible feelings of wanting them to get covid to hopefully teach them something?  Asking for me, unfortunately.",Variant,Neutral
484,1.46763E+18,2021-12-05T22:52:05.000Z,I've tried so hard for 2years to not expose my kid to Covid. And here we are. Fucked.,Demography,Negative
485,1.46763E+18,2021-12-05T22:52:02.000Z,"Cases: 265,807,863 (+54,939)  Deaths: 5,255,201 (+115)  Recovered: 0 (+0)  Active Cases: 265,807,863 (100%) Completed Cases: 5,255,201 (1.98%) Mortality Rate: 1.98% (No Change) Case Fatality Rate: 100.00% (No Change)  #COVID19 #Coronavirus #StayHome",Impact,Negative
486,1.46763E+18,2021-12-05T22:51:49.000Z,"If early treatment with safe, affordable drugs and targeted use of vaccines had been implemented appropriately,we would've been done with this COVID mess long ago. Public health policy prolonged it and exacerbated it with horrific collateral damage. Fear those idiots,not a virus.",Symptoms,Negative
487,1.46763E+18,2021-12-05T22:51:49.000Z,COVID sucks. Still can't taste. This isn't passing fast enough.,Impact,Positive
488,1.46763E+18,2021-12-05T22:51:49.000Z,"Why is America Not Working on Therapeutics? Why must everything be about getting the Jab!  You know who has the lowest covid cases in the  world, those taking therapeutics.   Lord Fauci won't have it, even if it saves lives, SICK!",Impact,Negative
489,1.46763E+18,2021-12-05T22:51:48.000Z,Covid be cock blockin bruh,Restrictions,Negative
490,1.46763E+18,2021-12-05T22:51:47.000Z,Have the mica people tried pretending their buildings have covid?   Could get all kindsa scratch…,Impact,Negative
491,1.46763E+18,2021-12-05T22:51:45.000Z,"Ivermectin, in proper doses, will stop Covid and all it's 'variants'.",Restrictions,Positive
492,1.46763E+18,2021-12-05T22:51:40.000Z,Somewhere there is a middle ground between 'all conspiracy theories are bunk' and 'I believe conspiracy theories.' This middle ground says Covid tyranny is the product of a number of wrong-headed decisions converging in herd type fashion. The middle ground position is stupid. 1/,Demography,Neutral
493,1.46763E+18,2021-12-05T22:51:35.000Z,"Nobody in this country COVID 19 me anything, that's these evil seals lieing keep up all this darn confusion. The evil liars",Restrictions,Positive
494,1.46763E+18,2021-12-05T22:51:33.000Z,Out sick tomorrow (sinus infection-Covid negative). Sorry 😩 Hoping for a sub! 🤞Will be back &amp; better than ever on Tuesday. ❤️ y’all!,Testing,Negative
495,1.46763E+18,2021-12-05T22:51:23.000Z,"I'm so happy BTS' LA tour went without a hitch. Like no one had Covid or no one got hurt and everyone was able to perform at the concerts. Most importantly, they had a great time in LA seeing ARMY",Vaccine,Negative
496,1.46763E+18,2021-12-05T22:51:20.000Z,COVID got me ready to die fr,Other,Negative
497,1.46763E+18,2021-12-05T22:51:19.000Z,In what world can people actually be okay with the government telling them what to wear and how to manage their INDIVIDUAL HEALTH? END ALL COVID RESTRICTIONS IMMEDIATELY AND DITCH THE IDIOTIC MASK MANDATE.,Variant,Negative
498,1.46763E+18,2021-12-05T22:51:13.000Z,Starting to worry about the 17 year old post covid. 😳,Symptoms,Negative
499,1.46763E+18,2021-12-05T22:51:12.000Z,"Just seen via twitter, why would Kate Garraway sit down to talk about her husband's fight with covid in an interview with Piers Morgan ? Someone who repeatedly broke lockdown rules &amp; supported his rule breaking celeb pals. I won't be catch up watching #piersmorganlifestories",Other,Negative
500,1.46763E+18,2021-12-05T22:51:09.000Z,"my mom might’ve been exposed to somebody with covid n even that won’t stop my grandma from being on her dick,, she wanna meet her maker so bad",Symptoms,Negative
501,1.46763E+18,2021-12-05T22:51:06.000Z,Taking notes from Dr. Atlas's book on the Covid Task Force.  Wonder why I keep typing in Renfield instead of Redfield for head of CDC?,Vaccine,Positive
502,1.46763E+18,2021-12-05T22:51:00.000Z,"I waited in line at @cvspharmacy for a COVID test as one customer sat there for an hour and 10 minutes discussing insurance. Meanwhile, multiple people behind me in line gave up and left. There is something seriously wrong here.",Restrictions,Positive
503,1.46763E+18,2021-12-05T22:50:58.000Z,"My #bride has #covid. She was suffering this morning. Gave her, and myself, #Ivermectin 0.1% solution by from the Local feed store, dosed it for her weight and #presto…6 hrs later she is out of bed, #fever gone, no pain or discomfort, clearly much improved. Ivermectin works.",Testing,Neutral
504,1.46763E+18,2021-12-05T22:50:56.000Z,what the fuck is this conspiracies im reading a staff have covid that's it stop making assumptions it's getting annoying,Demography,Negative
505,1.46763E+18,2021-12-05T22:50:55.000Z,Nobody talks about how weird people treat you after you had covid almost like you went to the shop and asked then for ONE OMICRON PLEASE,Demography,Neutral
506,1.46763E+18,2021-12-05T22:50:50.000Z,I’m really scared that I have covid. I feel like shit but rapid tests are negative so hopefully it’s just a flu,Other,Negative
507,1.46763E+18,2021-12-05T22:50:49.000Z,Fuck Covid 😔,Other,Neutral
508,1.46763E+18,2021-12-05T22:50:48.000Z,lose taste and smell bc of covid it’s the most annoying thing in this 2021 world,Symptoms,Negative
509,1.46763E+18,2021-12-05T22:50:46.000Z,A PSA for our #AntivaxPremier @fordnation: It’s time to stop with your cheesy campaigning photo ops and messaging. Ontario’s Covid pandemic is ramping up again due to your lack of leadership. You need to be telling everyone that #COVIDisAirborne and putting measures into place.,Restrictions,Positive
510,1.46763E+18,2021-12-05T22:50:40.000Z,"No Covid, no Party.",Variant,Neutral
511,1.46763E+18,2021-12-05T22:50:34.000Z,So where I getting a covid test the day before I travel in Lucia ?,Vaccine,Neutral
512,1.46763E+18,2021-12-05T22:50:26.000Z,"Remember when mainstream media had all the sheep shit scared about ISIL? Covid has become the new ‘war on terror’.   Order out of chaos. Create the chaos, create the order.",Symptoms,Positive
513,1.46763E+18,2021-12-05T22:50:22.000Z,423 new cases in Israel   [23:50 GMT] #coronavirus #CoronaVirusUpdate #COVID19 #CoronavirusPandemic,Other,Neutral
514,1.46763E+18,2021-12-05T22:50:19.000Z,"Ever feel like the so called medical experts, including grandpa Brandon just talk down to you when talking about Covid? What a turn off. 🤮",Restrictions,Negative
515,1.46763E+18,2021-12-05T22:50:16.000Z,Hi @ColleenB123 I have been watching you since COVID started and you light up my day. I recently watched Haters Back Off and it was sooo good. I would really like anything for my cousin who has cancer. Luv u,Impact,Positive
516,1.46763E+18,2021-12-05T22:50:15.000Z,"Pre covid when anyone got the sniffles &amp; aches did they run out and get tested or just buy Kleenex, and DayQuil?  I’ve been knocked out with illness for 4-5 days, high fever, run over by a bus feeling.. never a test",Vaccine,Positive
517,1.46763E+18,2021-12-05T22:50:12.000Z,"Re: Covid. We aren’t going back to “normal.” We’re vaccinated (some of us) but there is no social benefit because luddites have resisted. Get used to this nonsense, because we aren’t living life as we used to.",Other,Positive
518,1.46763E+18,2021-12-05T22:50:12.000Z,This @Ravens @steelers game is the worst offensive game I've seen in years. Who will step up and take control of this new covid variant called the AFC North? @JennaCherie01 any answers?,Symptoms,Negative
519,1.46763E+18,2021-12-05T22:50:11.000Z,Dude on the block selling weak ass mid saying it prevents Covid 😂 I love New York,Demography,Positive
520,1.46763E+18,2021-12-05T22:50:02.000Z,RT @Kit_Yates_Maths: “Covid will be mild for most people” is one of the most dangerous pieces of rhetoric pervading the pandemic.  I will remind you. A small proportion of a very large number can still be a very large number.,Testing,Negative
521,1.46763E+18,2021-12-05T22:49:59.000Z,Just in case anyone runs into my kids…. Here’s the story:  The elves have Covid.,Vaccine,Negative
522,1.46763E+18,2021-12-05T22:49:57.000Z,These COVID restrictions are starting to remind me of how the Jews were treated in pre-war Germany. You can’t sit there. You can’t go to store. You can’t travel without your papers. Tell you what. Get on the train. You going to Auschwitz.,Other,Negative
523,1.46763E+18,2021-12-05T22:49:55.000Z,"Each year we make large strides in our club’s history. The Cup WILL be ours one day. Fuck you Covid, Up the fucking Union!!! #doop",Demography,Negative
524,1.46763E+18,2021-12-05T22:49:55.000Z,#BestThingsToday 1. I have a backup computer; the laptop failed a diagnostic at the Genius Bar yesterday. Twice. 2. Tom had today to recover from his booster. Thrice vaxxed &amp; a Covid survivor; he is immortal now. ;) 3. The Christmas Coffeehouse playlist on Spotify.,Symptoms,Negative
525,1.46763E+18,2021-12-05T22:49:54.000Z,"Well that was totally worth the Covid, iron curtain and fire alarm hold ups! @4pmWineTimeBaby was blooming fantastic!!! 👏🏻 I haven’t laughed that hard in a long time! Perfect date night material! Thank you @IAmChrisRamsey and Rosie! 🍻❤️",Symptoms,Neutral
526,1.46763E+18,2021-12-05T22:49:51.000Z,COVID really fucked up my tastebuds and pretty much everything I LOVED tastes so gross now and I really wanna cry,Impact,Positive
527,1.46763E+18,2021-12-05T22:49:47.000Z,I have really enjoyed our country presentations. It is neat to compare each country's approach to the COVID-19 pandemic- how they differ and how they are similar. #GburgGHFall21,Symptoms,Negative
528,1.46763E+18,2021-12-05T22:49:47.000Z,"My niece just got a call that the after school program her youngest is in - has a COVID + case - so all are off to get tested.  F**king Ford - they did nothing to protect our kids.  #Thankful all vaxxed - youngest with 1 💉so far  179 days until June 2, 2022 #VoteThemAllOut2022",Vaccine,Negative
529,1.46763E+18,2021-12-05T22:49:47.000Z,"Heard this from a someone today who has covid:  ""I had a bit of a cold when I had my booster* - That must have meant it didn't work and that's why I have covid""  The mental gymnastics are strong with this one!  *3rd shot - same as the first two that clearly didn't work!",Symptoms,Neutral
530,1.46763E+18,2021-12-05T22:49:45.000Z,Ight so I'd rather prefer people to be up front when canceling on plans instead of the ol' we just gonna use #covid as an excuse thing 🙄🤔 ight got y'all 👍🏾👍🏾,Demography,Neutral
531,1.46763E+18,2021-12-05T22:49:44.000Z,Covid is F-ing Bullshit our Government and media is our real virus !,Testing,Positive
532,1.46763E+18,2021-12-05T22:49:43.000Z,"Ever think that these ppl saying they have covid, actually just have the flu or a cold? Hmmm?",Demography,Negative
533,1.46763E+18,2021-12-05T22:49:43.000Z,Sick as a dog. And no it’s not COVID,Other,Negative
534,1.46763E+18,2021-12-05T22:49:34.000Z,I have been out of town and didn’t know Union was COVID hobbled. So proud of their season.,Restrictions,Positive
535,1.46763E+18,2021-12-05T22:49:32.000Z,Day 5 of Covid.  I just want to say those guys in the Wuhan lab are a bunch of jerks!,Other,Positive
536,1.46763E+18,2021-12-05T22:49:30.000Z,"Covid origins come from pharma sponsored multi million dollar financed international PR advertising and  marketing agencies to sell billions of 1,2,3,4 vaccine shots and endless booster duds false tests masks and lock up humans to make billions for online shopping conglomerates",Other,Negative
537,1.46763E+18,2021-12-05T22:49:23.000Z,Now they’re saying that hippos have COVID 🤦🏾‍♂️,Testing,Neutral
538,1.46763E+18,2021-12-05T22:49:23.000Z,"#westminsterhour Interesting how they say there're no fruit pickers in Little England. When I switch on I hear politicians, especially Tories cherrypicking EU countries they look to compare UK with re Covid. Also ditto BBC on what's chosen to discuss. Plenty of low hanging fruit",Restrictions,Negative
539,1.46763E+18,2021-12-05T22:49:17.000Z,NO COVID BABIEEEE,Other,Neutral
540,1.46763E+18,2021-12-05T22:49:17.000Z,"Ron Desantis has:  - Presided over a broken unemployment system - Stomped on the first amendment by pushing an anti-protest bill - Signed a voter suppression bill - 60,150+ Floridians dead from COVID under his watch - Has done nothing to help Floridians struggling to pay rent",Other,Negative
541,1.46763E+18,2021-12-05T22:49:16.000Z,"I see anything serious in real life people on here🤐🤐🤐🤐  But anything LFC 🔴🔴🔴they can't wait to chat! Lol   Somethings are bigger &amp; more important than ⚽️⚽️⚽️⚽️  What's going on with his Covid-19 farce is definitely 1 of them!!  Said ""my peace""!!🤘🏾😁",Demography,Neutral
542,1.46763E+18,2021-12-05T22:49:10.000Z,"Imagine if Covid was a world war. Bombs going off everywhere, missiles fired. Foot soldiers spraying bullets. I'll bet there'd be businesses, airlines whining: ""We're going broke, we should be able to fly, people should be able to travel!But I wanna go on holiday! Why can't I!""",Other,Neutral
543,1.46763E+18,2021-12-05T22:49:07.000Z,Props to the parent who got so fed up of doing elf on a shelf that they stuck it into a glass kilner jar with a note saying ‘Covid positive - quarantine ten days’. That’s one way to avoid the task until Christmas!,Vaccine,Positive
544,1.46763E+18,2021-12-05T22:49:03.000Z,"Had a wonderful weekend away with my sisters, grandma, and mom. It was a yearly tradition until grandma got a cancer diagnosis three years ago, and we missed two years while she was in chemo, and then I missed last year because I had covid. We won't get many more because she",Testing,Neutral
545,1.46763E+18,2021-12-05T22:49:03.000Z,#49er 3rd-string QB KM#26 in covid protocol  after attending sex-party at Berghain last week,Restrictions,Neutral
546,1.46763E+18,2021-12-05T22:48:48.000Z,"#DavidDavid rubbishes the new borders bill &amp; demands illegal immigrants be allowed in from abroad, rather than stopped. #Britons, &amp; the rest of Europe’s public are exasperated &amp; exhausted by relentless economic migration, wokism, Covid &amp; being 2nd class citizens.",Other,Negative
547,1.46763E+18,2021-12-05T22:48:38.000Z,I want the Apple Watch please I lost my granddad to Covid last year and I really need this @ColleenB123,Vaccine,Positive
548,1.46763E+18,2021-12-05T22:48:36.000Z,Hawks v Hornets is gonna suck coz no Lamelo and no Scary Terry. COVID is ruining everything,Restrictions,Positive
549,1.46763E+18,2021-12-05T22:48:34.000Z,"Im aussie, I mostly use twitter for crypto/nft communities which quite frankly arent as prevalent here downunder. Ive only recently started to look more at what other aussies are tweeting and talking about in response to the covid/politcal mess/other nonsense.",Vaccine,Positive
550,1.46763E+18,2021-12-05T22:48:33.000Z,Human behaviour under the influence of covid-19.,Vaccine,Negative
551,1.46763E+18,2021-12-05T22:48:26.000Z,"Evermore 1 year anniversary is this week and I took 3 days off of work, had to give up a $200 aerial gig, and have to pay for subs for my 2 aerial classes because my husband and I got covid from an anti-vaxxer 😩 bummer if there’s merch because it’s a fav album but I’m broke AF",Variant,Neutral
552,1.46763E+18,2021-12-05T22:48:19.000Z,"In a xmas dinner more than 50 ICU staff from Malaga, Spain, have been infected with covid, leaving a shortage of staff of ICUs in the region. That is food for thought.",Other,Neutral
553,1.46763E+18,2021-12-05T22:48:15.000Z,"Maryland guard Eric Ayala said the Turgeon announcement felt similar to when he found out the NCAA Tournament in 2020 was canceled due to COVID. ""It had that feel to it. That shock.""",Other,Positive
554,1.46763E+18,2021-12-05T22:48:13.000Z,What if covid is fake like aids,Vaccine,Positive
555,1.46763E+18,2021-12-05T22:48:09.000Z,Mom won $500 at the covid vaccine tent by the house 😂 she deserves every bit of it,Symptoms,Neutral
556,1.46763E+18,2021-12-05T22:48:06.000Z,Hi! Not that you shouldn’t be taking it seriously already but COVID is getting real bad again so don’t be fucking stupid 😘,Vaccine,Negative
557,1.46763E+18,2021-12-05T22:47:59.000Z,Had a customer tell me she’s anti-vac after asking me how I dealt with being sick with Covid… girl I told you I survive because I was one of the lucky one… praise God … wasn’t pushing shit on to you so … stfu,Testing,Positive
558,1.46763E+18,2021-12-05T22:47:58.000Z,If Govt's want to impose FAKE vax #mandates than everyone should get fake vax cards   Its not illegal because the vax order is not legal. Get yout fake vax cards. Find a #doctor and pay him to sign it. EASY BREEZY  2 can play at that game #medicalapartheid  #Covid_19  #Covid19UK,Other,Neutral
559,1.46763E+18,2021-12-05T22:47:52.000Z,i think if covid gets a new name everytime it gets stronger and harder to beat i’m gonna start doing the same for my depressive episodes,Vaccine,Negative
560,1.46763E+18,2021-12-05T22:47:50.000Z,Kimmich isn’t available for the Barca game because he has to finish his research and subsequent dissertation on Covid-19.,Variant,Neutral
561,1.46763E+18,2021-12-05T22:47:45.000Z,"I really pray next year is much better year for me because the way I thought I wasn’t gonna make it out alive. The long covid , the depression, the distance from all my loved ones. Oh girl",Other,Neutral
562,1.46763E+18,2021-12-05T22:47:45.000Z,It's sucks that the unvaccinated people in Ireland are ruining it for everyone.  #selfish  #covid19,Vaccine,Negative
563,1.46763E+18,2021-12-05T22:47:41.000Z,I watching some selfies I took when I had covid in May and jesus christ I was sweating buckets. Explains why I was so dehydrated,Symptoms,Neutral
564,1.46763E+18,2021-12-05T22:47:40.000Z,"did you know, they skipped the animal trials for the mRNA vaccines? ... #COVID19",Vaccine,Positive
565,1.46763E+18,2021-12-05T22:47:39.000Z,"So I get time off til the Covid test comes back with results. Ok, gotta get tested tomorrow.",Other,Neutral
566,1.46763E+18,2021-12-05T22:47:36.000Z,Hi @ColleenB123 I have been watching you since COVID started and you light up my day. I recently watched Haters Back Off and it was sooo good. I would really like the Apple Watch for my cousin who has cancer. Luv u,Restrictions,Neutral
567,1.46763E+18,2021-12-05T22:47:34.000Z,42 Dbl 💉all get covid .. and you want me to get a shot of this useless juice? @premierbhiggs So much so that you are empowering grocery stores not to allow service without proof a useless shot? GFY Higgs,Other,Neutral
568,1.46763E+18,2021-12-05T22:47:30.000Z,New variant! Good! Per all known evolutionary understanding of viruses. This should be much weaker in side effect and much easier to spread. Rapidly approaching head cold status. #OmicronVariant #COVID19,Restrictions,Negative
569,1.46763E+18,2021-12-05T22:47:26.000Z,"Covid during winter be like. Glasses, mask, hat, hood, headphones, another hood",Restrictions,Neutral
570,1.46763E+18,2021-12-05T22:47:24.000Z,Professor Margie Danchin just explained to Tony Jones on 3AW that vaccinating children 5-11 years old prevents severe sickness in the kids that may lead to hospitalisation.  Jones didn’t bother asking how many kids that age have been hospitalised from Covid.  I wonder why.,Other,Neutral
571,1.46763E+18,2021-12-05T22:47:24.000Z,Think I got covid,Other,Neutral
572,1.46763E+18,2021-12-05T22:47:24.000Z,My disabled vaccinated son just tested positive for Covid. He's very compromised. It is insane we have any American not vaccinated.  Any person who believes it is their freedom they are protecting by not getting vaccinated is a selfish idiot not deserving to be in this country.,Symptoms,Negative
573,1.46763E+18,2021-12-05T22:47:23.000Z,"How about those avocado toasties with a hint of Rosemary , or is it basil? that I can pay $20 for at a  Cafe in Melbourne now. God, I feel so blessed , now I can talk to my friends about those under privileged children in the  third world thanks to @DanielAndrewsMP #COVID19",Vaccine,Positive
574,1.46763E+18,2021-12-05T22:47:22.000Z,"Austria - vaccine mandate and enforcement  From February 1, 2022, vaccination against Covid-19 will apply in Austria. According to a draft law, refusals face a fine of 600 euros every three months, as the Austrian Broadcasting Corporation (ORF) reported on Sunday.",Symptoms,Positive
575,1.46763E+18,2021-12-05T22:47:16.000Z,"Overheard in Phoenix airport: “I heard deer have covid antibodies and I’m a deer hunter, but I’ve never been able to get anywhere close to 6 feet near a deer, so I think they just made that whole distance thing up”",Symptoms,Negative
576,1.46763E+18,2021-12-05T22:47:13.000Z,"Chicago Tribune DECEMBER 5, 2021 Parents and students protest new COVID-19 restrictions at Oak Park-River Forest High School following rising transmission rate Around 30 cases of COVID-19 have cropped up in the past two weeks at Oak Park-River Forest High School.",Demography,Positive
577,1.46763E+18,2021-12-05T22:47:09.000Z,Y’all remember how covid was supposed to last like two weeks? It’s been two years bro almost three 😭,Demography,Neutral
578,1.46763E+18,2021-12-05T22:47:07.000Z,bro there is a crazy amount of carwashes popping up since covid hit lol these narcos definitely binged breaking bad &amp; got inspired at,Restrictions,Negative
579,1.46763E+18,2021-12-05T22:47:05.000Z,I’ve been on twitter way too much since I got Covid lmao I need to chill,Restrictions,Negative
580,1.46763E+18,2021-12-05T22:46:59.000Z,covid kicking my ass rn brah,Symptoms,Negative
581,1.46763E+18,2021-12-05T22:46:58.000Z,"Friends who lived in India for many yrs as expatriates refused to get #vaccinated, bc Eric Clapton, 🤬now left India and are in OR, still unvaxxed &amp; planning trip to California. We are vaccinated seniors in a small condo. Should we let them visit us? #COVID19",Restrictions,Positive
582,1.46763E+18,2021-12-05T22:46:55.000Z,"I’m not going to lie, Trump eating McDonalds when he thought he was going to die of COVID is extremely relatable because when I’m super depressed one of the easiest things to eat is those fries.",Symptoms,Positive
583,1.46763E+18,2021-12-05T22:46:55.000Z,I know more people with blood clots and strokes then I do people with Covid .🤔,Demography,Negative
584,1.46763E+18,2021-12-05T22:46:54.000Z,"One good thing about covid, it's stopped all those optimistic people from saying next year is there year 😂",Testing,Positive
585,1.46763E+18,2021-12-05T22:46:49.000Z,Lost another colleague to Covid. Please be careful y’all. This shit it still taking people out!,Testing,Negative
586,1.46763E+18,2021-12-05T22:46:47.000Z,no one wears a mask in mn and we have the highest covid rates. wild 💀,Demography,Negative
587,1.46763E+18,2021-12-05T22:46:44.000Z,I guess my question is do we have proof that covid is spreading at grocery stores or are we just making rules to look busy again,Symptoms,Neutral
588,1.46763E+18,2021-12-05T22:46:41.000Z,"God this Covid really is relentless ain't it? Day 4,approx 70hrs flat out in bed,which ain't too bad. I'm 46 and relatively fit but feel about 100 now. When does this shit subside? Goodness knows how the sick and vulnerable manage 🙏💚x",Vaccine,Positive
589,1.46763E+18,2021-12-05T22:46:33.000Z,"Apologies for sounding like a broken record, but here in Spain where I am lucky to spend my academic sabbatical studying a COVID Apartment outbreak everyone wears masks. Everywhere. COVID vaccine passports required for cafes and restaurants and indoor events. It’s so civilized.",Other,Positive
